{"$defs":{"entry":{"additionalProperties":false,"properties":{"baseline":{"description":"The control: the in-force version (or named alternative) this item's delta was measured against.","minLength":1,"type":"string"},"content":{"description":"What the item is — the content whose place is being priced.","minLength":1,"type":"string"},"date":{"description":"Date (YYYY-MM-DD) of the measurement this entry records.","format":"date","pattern":"^[0-9]{4}-[0-9]{2}-[0-9]{2}$","type":"string"},"decision":{"description":"The human decision this entry's measurement fed, when one is recorded (e.g. an operating-point call the measurement informed but did not make).","type":"string"},"delta":{"description":"The measured numbers, in both directions where the instrument shows both.","minLength":1,"type":"string"},"gate":{"description":"The pre-registered yardstick and gate legs this measurement was priced under.","minLength":1,"type":"string"},"id":{"description":"Entry identifier within the record (GC-1, CR-3, DC-2, CC-4, OB-1, ...).","minLength":1,"type":"string"},"instrument":{"description":"The measuring instrument: the run, harness, or analysis that produced the numbers.","minLength":1,"type":"string"},"population":{"description":"The corpus population and its fitting/evaluation split relationship (held-out gold only, PACK_DESIGN §2.1).","minLength":1,"type":"string"},"status":{"description":"adopted / measured_adopted: priced and in force. measured_baseline: the control reading later items price against. measured_pilot: a pilot-scale pricing. measured_not_adopted: priced and not adopted. closed: priced and the route closed against re-proposal without new evidence. emitted_unmeasured: builder-emitted artifact; no measurement has priced it.","enum":["adopted","measured_adopted","measured_baseline","measured_pilot","measured_not_adopted","closed","emitted_unmeasured"]},"treatment":{"description":"The item as applied for the measurement (the payload bytes, variant, or artefact priced).","minLength":1,"type":"string"},"verdict":{"description":"The outcome in words, carrying the gate result; a negative result stands with the same standing as a positive one.","minLength":1,"type":"string"}},"required":["id","date","status","content","treatment","baseline","population","instrument","delta","gate","verdict"],"type":"object"}},"$id":"conformance.schema.json","$schema":"https://json-schema.org/draft/2020-12/schema","additionalProperties":false,"description":"The field-level schema for a pack conformance record, formalizing docs/PACK_DESIGN.md §2. Every entry is one priced item: a negative result is recorded with the same standing as a positive one — the record is the pack's memory of what not to re-propose without new evidence. Validated by pipeline.pack_schema and by `ontosmith ontology check`.","properties":{"entries":{"description":"The priced items, in record order.","items":{"$ref":"#/$defs/entry"},"minItems":1,"type":"array"},"pack_id":{"description":"The pack this record belongs to; matches the manifest's pack_id.","pattern":"^[a-z0-9]+(-[a-z0-9]+)*$","type":"string"},"pack_version":{"description":"The pack version the record was opened under. Measurements accumulate across versions; each entry carries its own date, and adoption as a newer version is itself an entry or a manifest note.","pattern":"^[0-9]+\\.[0-9]+\\.[0-9]+$","type":"string"},"record_format":{"const":1,"type":"integer","description":"Conformance record format version."},"spec":{"description":"The measurement spec this record follows; shipped records cite docs/PACK_DESIGN.md §2.","minLength":1,"type":"string"}},"required":["record_format","pack_id","pack_version","spec","entries"],"title":"OntoSmith pack conformance record (conformance.json, record_format 1)","type":"object"}